{
  "$schema": "./schemas/security_review.schema.json",
  "$depends_on": ["requirements.json", "architecture.json"],
  "engagement_id": "eng-2026-001",
  "version": "1.0",
  "last_updated": "2026-03-15",
  "status": "complete",

  "security_requirements": {
    "authentication": {
      "mechanism": "SSO via SAML 2.0/OIDC with MFA enforcement for all users",
      "mfa_methods": ["TOTP", "push_notification", "hardware_token"],
      "session_management": "JWT with 15-minute access token lifetime, 8-hour refresh token, auto-logout after 10 minutes of inactivity for PHI protection",
      "password_policy": "Managed by external IdP — minimum 12 characters, complexity requirements enforced at IdP, 90-day rotation",
      "brute_force_protection": "Account lockout after 5 failed attempts, CAPTCHA after 3 failures, exponential backoff"
    },
    "secrets_management": {
      "tool": "AWS Secrets Manager with automatic rotation",
      "rotation_policy": "90-day rotation for service credentials, 30-day for IBMi connection credentials",
      "ibmi_credentials": "IBMi service account credentials stored in Secrets Manager, never in code or config files, rotated on 30-day cycle",
      "tls_certificates": "ACM-managed certificates with auto-renewal for public endpoints, self-managed certificates for IBMi VPN tunnel",
      "encryption_keys": "AWS KMS customer-managed keys for PHI encryption at rest, separate keys per environment"
    },
    "network_isolation": {
      "vpc_design": "Dedicated VPC with public, private, and data subnets across 2 availability zones",
      "public_subnet": "ALB and WAF only — no application components directly internet-facing",
      "private_subnet": "ECS Fargate tasks (API Gateway, Business Logic, IAM Service, Audit Service), Redis cache",
      "data_subnet": "PostgreSQL RDS (audit logs, user directory), SQS queues",
      "ibmi_connectivity": "Site-to-site VPN or AWS Direct Connect from private subnet to on-premises IBMi — no public internet traversal",
      "security_groups": "Least-privilege security groups per component; C-003 (IBMi DAL) can only reach IBMi on ODBC/JDBC ports, C-007 (Audit) can only reach PostgreSQL on port 5432",
      "nacls": "Stateless network ACLs as defense-in-depth backup to security groups"
    },
    "ai_guardrails": {
      "applicability": "Not applicable for current phase — this is a UI modernization engagement with no AI/ML components",
      "future_phase_notes": "If AI features are added in Phase 3+, PHI data must never be sent to external AI services without BAA, de-identification, or on-premises model hosting"
    },
    "compliance": {
      "primary_framework": "HIPAA (Health Insurance Portability and Accountability Act)",
      "additional_frameworks": ["HITECH Act", "ADA Section 508"],
      "baa_required": true,
      "baa_status": "Required with cloud provider (AWS or Azure) before any PHI data enters cloud environment",
      "phi_handling": "PHI encrypted at rest (AES-256) and in transit (TLS 1.2+), field-level encryption for SSN and MRN, access logged to immutable audit store",
      "data_retention": "7-year retention for audit logs per HIPAA requirement, patient data retained per state medical record retention laws"
    }
  },

  "threat_model": {
    "methodology": "STRIDE",
    "scope": "End-to-end modernized application platform including React web UI, NestJS API gateway, IBMi Data Access Layer, IAM service, business logic services, cache layer, audit logging, and all data flows between components. Excludes IBMi AS/400 internal security (client-managed) and external IdP infrastructure.",
    "threats": [
      {
        "id": "T-001",
        "category": "spoofing",
        "description": "Attacker steals or forges JWT tokens to impersonate legitimate clinical users and access PHI. Expired or stolen tokens could be replayed against the API Gateway to gain unauthorized access to patient records.",
        "affected_components": ["C-002", "C-004", "C-005"],
        "severity": "critical",
        "likelihood": "medium",
        "risk_score": 8,
        "mitigation": "Short-lived JWTs (15-minute expiry), refresh token rotation with one-time use enforcement, token binding to client IP and device fingerprint, JWT signature validation at API Gateway (C-002) on every request, token revocation list in Redis (C-006), MFA required for all users via IAM service (C-004).",
        "residual_risk": "low",
        "status": "mitigated"
      },
      {
        "id": "T-002",
        "category": "tampering",
        "description": "Malicious modification of patient data in transit between the modern web UI and IBMi backend. An attacker with network access could intercept and alter clinical data (medication orders, lab results, billing codes) as it passes through the API Gateway to the IBMi DAL.",
        "affected_components": ["C-001", "C-002", "C-003", "C-005"],
        "severity": "critical",
        "likelihood": "low",
        "risk_score": 7,
        "mitigation": "TLS 1.2+ enforced on all external connections (DF-001), mTLS between internal services (DF-002), request signing for write operations to IBMi, input validation at API Gateway (C-002) and Business Logic (C-005) layers, EBCDIC conversion integrity checks in IBMi DAL (C-003), database-level constraints in DB2/400.",
        "residual_risk": "negligible",
        "status": "mitigated"
      },
      {
        "id": "T-003",
        "category": "repudiation",
        "description": "Clinical users deny accessing or modifying PHI records. Without comprehensive audit trails, the organization cannot prove who accessed what patient data and when, creating HIPAA compliance exposure and inability to investigate potential breaches.",
        "affected_components": ["C-005", "C-007"],
        "severity": "high",
        "likelihood": "medium",
        "risk_score": 7,
        "mitigation": "Immutable append-only audit log in PostgreSQL (C-007) capturing user identity, timestamp, patient record ID, action type, and source IP for every PHI access event. Audit events written asynchronously via message queue to prevent bypass. Correlation IDs link audit records across all service calls. 7-year retention with tamper-evident checksums. Audit log access restricted to compliance officers only.",
        "residual_risk": "low",
        "status": "mitigated"
      },
      {
        "id": "T-004",
        "category": "information_disclosure",
        "description": "Unauthorized exposure of Protected Health Information (PHI) through application logs, error messages, API responses, or cache contents. PHI fields (SSN, MRN, diagnosis, medications) could leak into CloudWatch logs, Redis cache dumps, or verbose API error responses accessible to unauthorized parties.",
        "affected_components": ["C-001", "C-002", "C-005", "C-006", "C-008"],
        "severity": "critical",
        "likelihood": "medium",
        "risk_score": 9,
        "mitigation": "PHI field masking in all application logs (only audit logs contain full PHI). Structured logging with explicit allow-list of loggable fields. Redis cache encryption at rest and in transit, TTL-based eviction. API error responses return generic messages without PHI or stack traces. Field-level encryption for SSN and MRN in transit and at rest. CloudWatch log groups with IAM-restricted access. Monitoring dashboard (C-008) displays only aggregated metrics, never individual PHI.",
        "residual_risk": "low",
        "status": "mitigated"
      },
      {
        "id": "T-005",
        "category": "denial_of_service",
        "description": "IBMi connection pool exhaustion through excessive or malicious API requests. The IBMi DAL (C-003) is limited to 50 concurrent ODBC/JDBC connections. A flood of requests — whether from a DDoS attack, a runaway client-side process, or a legitimate traffic spike — could exhaust the pool and deny access to all clinical users across all 3 facilities.",
        "affected_components": ["C-002", "C-003", "C-005"],
        "severity": "high",
        "likelihood": "medium",
        "risk_score": 7,
        "mitigation": "WAF with rate limiting at ALB edge (per-IP and per-user throttling). API Gateway (C-002) enforces per-user and per-module rate limits. Circuit breaker pattern in IBMi DAL (C-003) with configurable connection pool limits and queue-based backpressure. Redis cache (C-006) absorbs read-heavy queries to reduce IBMi load. Health check monitoring (C-008) with auto-alerting when pool utilization exceeds 80%. AWS Shield Standard for DDoS protection at network layer.",
        "residual_risk": "medium",
        "status": "mitigated"
      },
      {
        "id": "T-006",
        "category": "elevation_of_privilege",
        "description": "A user with a low-privilege role (e.g., front-desk registration clerk) escalates to a clinical role (e.g., physician or pharmacist) by manipulating JWT claims, exploiting RBAC misconfigurations, or bypassing the IAM service. This could grant access to controlled substance records, clinical documentation, or billing functions beyond the user's authorized scope.",
        "affected_components": ["C-002", "C-004", "C-005"],
        "severity": "critical",
        "likelihood": "low",
        "risk_score": 8,
        "mitigation": "JWT claims validated server-side on every request at API Gateway (C-002) — never trust client-provided role claims. Role mappings managed exclusively in IdP and IAM service (C-004) by authorized administrators. Principle of least privilege: each business logic module (C-005) enforces its own authorization checks independent of API Gateway. Role hierarchy with explicit deny rules for cross-boundary access. Quarterly access reviews by compliance team. Privileged role changes require dual approval. Anomaly detection alerts in monitoring (C-008) for unusual access patterns.",
        "residual_risk": "low",
        "status": "mitigated"
      },
      {